Group ID,Segment ID,Text,Length,Group Tagging,Relative Loc Tgging,Expected Beginning,Expected Middle,Expected End,"Expected Standalone
",Beginning Score,Beginning Correct,End Score,End Correct
80,3647,"I believe we can make it work with a US number and forward to your China number, but again, I'll have to check with our tech support team. I'll be sure t o include that information with the quote we send",203,0,0,1,0,1,1,7.29295652592557,1,2.0811654526534857,0
80,3648,You wouldn't be replying to your US number. You would be replying to the customer who originally sent the message but they would receive it as being from  the US number,168,1,0,1,0,1,1,8.006991363609659,1,4.0570377184912605,1
80,3649,"But essentially, yes. You could reply from your China number",60,2,0,1,0,1,1,7.780748663101605,1,4.0570377184912605,1
81,3650,Sorry about that. Did you try to email Jesse.askew@clcworld.com ?,65,0,0,1,0,1,1,11.664466446644663,1,33.43065174924524,1
81,3651,Gotcha.  Have a nice day!,25,1,0,1,0,1,1,12.96774193548387,1,15.600180668473351,1
82,3661,"We build chat bots for companies who need them, but are strong advocates of the personal touch",94,0,0,1,0,1,1,9.753115264797508,1,3.258064516129032,1
82,3662,Which why a human (aka me) is replying to you right now,55,1,0,1,0,1,1,12.797491039426523,1,4.478775226165623,1
83,3666,Hi there! Thanks for reaching out! How can we help you?,55,0,0,1,0,1,1,188.8708609271523,1,33.43065174924524,1
83,3667,Nope!  I'm a real person! We do build bots for other companies though!,70,1,0,1,0,1,1,39.72727272727273,1,15.600180668473351,1
84,3672,Hi Kevin,8,0,0,1,0,1,1,188.8708609271523,1,4.136363636363637,1
84,3673,How goes it?,12,1,0,1,0,1,1,16.705188679245282,1,33.43065174924524,1
84,3674,What can we do for you?,23,2,0,1,0,1,1,17.140350877192983,1,33.43065174924524,1
85,3676,Hi Guarav. What can we do for you?,34,0,0,1,0,1,1,188.8708609271523,1,33.43065174924524,1
85,3677,How can I help?,15,1,0,1,0,1,1,16.705188679245282,1,33.43065174924524,1
85,3678,Real person here,16,2,0,1,0,1,1,8.036269430051814,1,4.144557823129252,1
85,3679,We build bots for companies!,28,3,0,1,0,1,1,9.753115264797508,1,15.600180668473351,1
86,3689,HQ],3,0,2,0,0,1,0,0.24390243902439024,1,7.375886524822696,1
86,3690,"That's great. We actually just caught the TV story ourselves! Please let me
know personally if there's anything I can help you with as you use the app [David at",160,0,1,1,0,0,0,8.399215686274509,1,2.1003861003861,1
87,3728,Got it,6,0,0,1,0,1,1,9.83757338551859,1,2.710781207567665,1
87,3729,Thank you,9,1,0,1,0,1,1,21.77894257064722,1,3.1638616175783074,1
88,3743,Hello David,11,2,0,1,0,1,1,106.93243243243244,1,2.123762376237624,0
88,3744,I have uninstalled the app,26,3,0,1,0,1,1,7.29295652592557,1,3.25,1
89,3867,Its here,8,0,0,1,0,1,1,11.453441295546558,1,4.144557823129252,1
89,3868,Yes i have it,13,1,0,1,0,1,1,43.46258503401361,1,2.710781207567665,1
90,3878,"Hi, thanks for reaching out. Per our FAQ page, we ship our boxes on the first of the month. So, we will ship your order 8/1 and you will be updated with a tracking #.",166,0,0,1,0,1,1,188.8708609271523,1,12.312931923179718,1
90,3879,Was there anything else I could help with?,42,1,0,1,0,1,1,4.8671291355389545,1,33.43065174924524,1
91,3902,Does it have lock and unlock built into the key ?,49,0,0,1,0,1,1,11.383920076117983,1,33.43065174924524,1
91,3903,Use coupon SNOW50 To save $50,29,1,0,1,0,1,1,2.1225114854517613,0,2.268041237113402,0
91,3904,http://stereowestautotoys.com/viper-4816v-2-way-led-remote-start/,65,2,0,1,0,1,1,0.4878048780487805,0,0,0
92,3908,If you order it online someone will call you to set up your appointment - very easy,83,0,0,1,0,1,1,9.127659574468085,1,2.2363636363636363,0
92,3909,We can do it either way no problem,34,1,0,1,0,1,1,9.753115264797508,1,4.538095238095238,1
93,3942,Please call our office line at 7035448634,41,0,0,1,0,1,1,10.45679012345679,1,2,0
93,3943,Because of privacy we can not confirm your identity on here.,60,1,0,1,0,1,1,7.726172465960666,1,12.312931923179718,1
94,3947,I would recommend our level III film which is $319 on that car installed,72,0,0,1,0,1,1,7.29295652592557,1,3.625,1
94,3948,"Comes with a lifetime warranty , better heat rejection and scratch guard",72,1,0,1,0,1,1,7.0,1,2.0,0
95,3959,Hi! Thanks for your continued support. We really appreciate it! Here is the link to our gift card....,101,0,0,1,0,1,1,193.8708609271523,1,12.312931923179718,1
95,3960,https://zen-threads.com/products/gift-card,42,1,0,1,0,1,1,0.0,0,0,0
96,3997,Hi there.,9,0,0,1,0,1,1,188.8708609271523,1,12.312931923179718,1
96,3998,Ok. I can help u with that,26,1,0,1,0,1,1,42.458333333333336,1,2.3868471953578334,1
97,4003,Senior tickets (ages 62 and older) for DIRTY BLONDE are $16 both online and at the door.,88,0,0,1,0,1,1,9.222222222222221,1,12.312931923179718,1
97,4004,All ticket prices can be found on our TICKETS link at www.buckcreekplayers.com.,79,1,0,1,0,1,1,8.041764429845143,1,12.312931923179718,1
98,4010,"Angelina, Ava, Pink Rose Shift, Floral Jacquard, Summer Dot, Summer Tiered,",75,0,0,1,0,1,1,0,0,-2.399596278743198,0
98,4011,The Cleo Jummper is a beautiful alternative to a dress for summer.,66,1,0,1,0,1,1,7.825841603424791,1,12.312931923179718,1
99,4093,"They are both very similar. The big difference is the scent. The main ingredient in La Flora is Barbary Fig Seed Oil with is wonderful for breakout prone  skin, however the addition of the cactus flower gives it the most beautiful scent and some added antioxidants and vitamins.",278,0,0,1,0,1,1,8.340834505391467,1,12.312931923179718,1
99,4094,La Flora is also a limited edition product so if it's something your considering you may want to grab one now. Hope this helps! Let me know if you have a dditional questions.,174,1,0,1,0,1,1,3.081081081081081,0,12.312931923179718,1
total valid sentences: 218
correct beginning segments: 214
beginning precision: 0.981651376147
correct end segments: 194
end precision: 0.889908256881
